{
  "artifact_hashes": {
    "CODE/work/WP-LEO-V2-GLOBAL-PRESSURE-BRACKET/R01/coverage-audit.json": "b5631b2d4e40bc96b77e69459ae50b44b467d08b22373fcd4e63e7ebbe8912ae",
    "CODE/work/WP-LEO-V2-GLOBAL-PRESSURE-BRACKET/R01/scene-decision.yaml": "9ad82a9ac4c4f86c13e38881236f8a438c2750140b7a6a8d49f7929e98b17d9b",
    "CODE/work/WP-LEO-V2-GLOBAL-PRESSURE-BRACKET/R02/brief.json": "054b311e7bbb874a078a42c1a0cfc077761675867bbd984d1d9c94e93856187d",
    "CODE/work/WP-LEO-V2-GLOBAL-PRESSURE-BRACKET/R02/scene-check-contract.json": "b9b3f75378b6d1f81fb46624193ca35d6ebb41a9c5970d689f6e78a4366a26b7",
    "EXPERIMENTS/EXP-20260829-GLOBAL-PRESSURE-BRACKET-R02/RUNBOOK.md": "5bb03c92d3d821a971cb8c0af3e449a2bfa652befdacf95c38dfb5a6ed3fa735",
    "EXPERIMENTS/EXP-20260829-GLOBAL-PRESSURE-BRACKET-R02/analysis-request.json": "9b38b054c26b0f057d34ac1729b0804263344f810fb8bf5fd14cd11c3d28261c",
    "EXPERIMENTS/EXP-20260829-GLOBAL-PRESSURE-BRACKET-R02/compile-report.json": "3cdecca676c2cd2e76f6efe3e40386c33cad5d85e56b2e8d55acaebc176e9d46",
    "EXPERIMENTS/EXP-20260829-GLOBAL-PRESSURE-BRACKET-R02/request.json": "c3428fe71d5938a148f0f97a9a1b1e7d89f37e6f44d7ce209e49bf562bea37a2",
    "EXPERIMENTS/EXP-20260829-GLOBAL-PRESSURE-BRACKET-R02/resolved/EXP-20260829-GLOBAL-PRESSURE-BRACKET-R02-load10_a-s11.leo-sim.yaml": "6c9ad101101036b740cd822f881081bd2728c63bab0853202f4ae4d03e602e73",
    "EXPERIMENTS/EXP-20260829-GLOBAL-PRESSURE-BRACKET-R02/resolved/EXP-20260829-GLOBAL-PRESSURE-BRACKET-R02-load10_a-s19.leo-sim.yaml": "8793d827a10367e748f9c8ee576e656fb0dddacc8f80293d47c3009b34eb4a58",
    "EXPERIMENTS/EXP-20260829-GLOBAL-PRESSURE-BRACKET-R02/resolved/EXP-20260829-GLOBAL-PRESSURE-BRACKET-R02-load10_a-s7.leo-sim.yaml": "f74684451a314174a8dccc38ae56294f73d57e7de0e489fa9f6ea8ed546c70f4",
    "EXPERIMENTS/EXP-20260829-GLOBAL-PRESSURE-BRACKET-R02/resolved/EXP-20260829-GLOBAL-PRESSURE-BRACKET-R02-load10_b-s11.leo-sim.yaml": "6c9ad101101036b740cd822f881081bd2728c63bab0853202f4ae4d03e602e73",
    "EXPERIMENTS/EXP-20260829-GLOBAL-PRESSURE-BRACKET-R02/resolved/EXP-20260829-GLOBAL-PRESSURE-BRACKET-R02-load10_b-s19.leo-sim.yaml": "8793d827a10367e748f9c8ee576e656fb0dddacc8f80293d47c3009b34eb4a58",
    "EXPERIMENTS/EXP-20260829-GLOBAL-PRESSURE-BRACKET-R02/resolved/EXP-20260829-GLOBAL-PRESSURE-BRACKET-R02-load10_b-s7.leo-sim.yaml": "f74684451a314174a8dccc38ae56294f73d57e7de0e489fa9f6ea8ed546c70f4",
    "EXPERIMENTS/EXP-20260829-GLOBAL-PRESSURE-BRACKET-R02/resolved/EXP-20260829-GLOBAL-PRESSURE-BRACKET-R02-load20_a-s11.leo-sim.yaml": "74fde0058267950366ae49c9c9e5721020b36c226c30f20c30f1ce72c4a9f8e2",
    "EXPERIMENTS/EXP-20260829-GLOBAL-PRESSURE-BRACKET-R02/resolved/EXP-20260829-GLOBAL-PRESSURE-BRACKET-R02-load20_a-s19.leo-sim.yaml": "64f92c2d08b2287cd5a1a7faad9c598f70a317019069ee0e574883c80a9ecc48",
    "EXPERIMENTS/EXP-20260829-GLOBAL-PRESSURE-BRACKET-R02/resolved/EXP-20260829-GLOBAL-PRESSURE-BRACKET-R02-load20_a-s7.leo-sim.yaml": "779b17adda9defe9b6beadbcf4310828619a6b1539811b490fa8eb2e92f8a504",
    "EXPERIMENTS/EXP-20260829-GLOBAL-PRESSURE-BRACKET-R02/resolved/EXP-20260829-GLOBAL-PRESSURE-BRACKET-R02-load20_b-s11.leo-sim.yaml": "74fde0058267950366ae49c9c9e5721020b36c226c30f20c30f1ce72c4a9f8e2",
    "EXPERIMENTS/EXP-20260829-GLOBAL-PRESSURE-BRACKET-R02/resolved/EXP-20260829-GLOBAL-PRESSURE-BRACKET-R02-load20_b-s19.leo-sim.yaml": "64f92c2d08b2287cd5a1a7faad9c598f70a317019069ee0e574883c80a9ecc48",
    "EXPERIMENTS/EXP-20260829-GLOBAL-PRESSURE-BRACKET-R02/resolved/EXP-20260829-GLOBAL-PRESSURE-BRACKET-R02-load20_b-s7.leo-sim.yaml": "779b17adda9defe9b6beadbcf4310828619a6b1539811b490fa8eb2e92f8a504",
    "EXPERIMENTS/EXP-20260829-GLOBAL-PRESSURE-BRACKET-R02/resolved/EXP-20260829-GLOBAL-PRESSURE-BRACKET-R02-load40_a-s11.leo-sim.yaml": "6313047a59e1c5287c0e72b5b8212e48e4b4a04fd63c1b4b784b973dfc1d91b2",
    "EXPERIMENTS/EXP-20260829-GLOBAL-PRESSURE-BRACKET-R02/resolved/EXP-20260829-GLOBAL-PRESSURE-BRACKET-R02-load40_a-s19.leo-sim.yaml": "b12b4f8551928c2de1204b69542559bf57869bb73cf72d66379850245c16b791",
    "EXPERIMENTS/EXP-20260829-GLOBAL-PRESSURE-BRACKET-R02/resolved/EXP-20260829-GLOBAL-PRESSURE-BRACKET-R02-load40_a-s7.leo-sim.yaml": "d0311b13c4f23e2ff0ebbbdb9d5986d2bc720eeb8c480f859b474bd6f62a4082",
    "EXPERIMENTS/EXP-20260829-GLOBAL-PRESSURE-BRACKET-R02/resolved/EXP-20260829-GLOBAL-PRESSURE-BRACKET-R02-load40_b-s11.leo-sim.yaml": "6313047a59e1c5287c0e72b5b8212e48e4b4a04fd63c1b4b784b973dfc1d91b2",
    "EXPERIMENTS/EXP-20260829-GLOBAL-PRESSURE-BRACKET-R02/resolved/EXP-20260829-GLOBAL-PRESSURE-BRACKET-R02-load40_b-s19.leo-sim.yaml": "b12b4f8551928c2de1204b69542559bf57869bb73cf72d66379850245c16b791",
    "EXPERIMENTS/EXP-20260829-GLOBAL-PRESSURE-BRACKET-R02/resolved/EXP-20260829-GLOBAL-PRESSURE-BRACKET-R02-load40_b-s7.leo-sim.yaml": "d0311b13c4f23e2ff0ebbbdb9d5986d2bc720eeb8c480f859b474bd6f62a4082",
    "EXPERIMENTS/EXP-20260829-GLOBAL-PRESSURE-BRACKET-R02/resolved/EXP-20260829-GLOBAL-PRESSURE-BRACKET-R02-load80_a-s11.leo-sim.yaml": "c231baa447683b7e0be6cd64316c361fb2bdc4bc4e9159c71af08074d0cc60a7",
    "EXPERIMENTS/EXP-20260829-GLOBAL-PRESSURE-BRACKET-R02/resolved/EXP-20260829-GLOBAL-PRESSURE-BRACKET-R02-load80_a-s19.leo-sim.yaml": "762b98846282aa955c20eb801f71192c58900eacfe6d4f6267f4eac45f1eae4f",
    "EXPERIMENTS/EXP-20260829-GLOBAL-PRESSURE-BRACKET-R02/resolved/EXP-20260829-GLOBAL-PRESSURE-BRACKET-R02-load80_a-s7.leo-sim.yaml": "55f0d7d4149b500b0895293df5e1d26377b07de535cbac2ae5be4a8ffe8981ad",
    "EXPERIMENTS/EXP-20260829-GLOBAL-PRESSURE-BRACKET-R02/resolved/EXP-20260829-GLOBAL-PRESSURE-BRACKET-R02-load80_b-s11.leo-sim.yaml": "c231baa447683b7e0be6cd64316c361fb2bdc4bc4e9159c71af08074d0cc60a7",
    "EXPERIMENTS/EXP-20260829-GLOBAL-PRESSURE-BRACKET-R02/resolved/EXP-20260829-GLOBAL-PRESSURE-BRACKET-R02-load80_b-s19.leo-sim.yaml": "762b98846282aa955c20eb801f71192c58900eacfe6d4f6267f4eac45f1eae4f",
    "EXPERIMENTS/EXP-20260829-GLOBAL-PRESSURE-BRACKET-R02/resolved/EXP-20260829-GLOBAL-PRESSURE-BRACKET-R02-load80_b-s7.leo-sim.yaml": "55f0d7d4149b500b0895293df5e1d26377b07de535cbac2ae5be4a8ffe8981ad",
    "EXPERIMENTS/EXP-20260829-GLOBAL-PRESSURE-BRACKET-R02/run-manifest.json": "39149c5fac76520c4ff06485c7fc4c0949fd971f1def4183688c03350e8b8ffe"
  },
  "blocking_findings": [],
  "evidence": [
    "Round-6 scoped review at fb75e31: limits raise sound (load40 measured 2001 entities, 10x headroom); max_events headroom covers load80; no other cap trips at loads 10-80 (max_packets unit-scale ~1600 max at load80 < 5000); superseded 12-cell statement accurate; chain rebuild on rev5 hashes mandatory - old evidence blocked from mixing.",
    "Domain chain: per-load a/b determinism; preregistered ISL-unreachability expectation and truncation disclosure carried; VM budget 24 x ~20 min serial plausible."
  ],
  "independence": {
    "producer_and_reviewer_are_distinct": true,
    "review_started_from_declared_inputs": true
  },
  "producer_id": "producer:codex-global-pressure",
  "producer_session_id": "P-bracket-r02-request",
  "receipt_id": "RR-GLOBAL-PRESSURE-R02-SAT",
  "required_revision": [],
  "reviewer_id": "reviewer:kimi-cli-541b31cdbd4a",
  "reviewer_session_id": "R-kimi-cli-541b31cd-bd4a-4dff-85e9-645550a64107",
  "revision": 5,
  "role": "satellite_drl",
  "schema": "agent-review-receipt/v2",
  "unknowns": [],
  "verdict": "PASS",
  "work_id": "WP-LEO-V2-GLOBAL-PRESSURE-BRACKET"
}
