{"artifact_hashes": {"EXPERIMENTS/EXP-LEO-V2-ACCEPT-R4/RUNBOOK.md": "c174a488c1ef86c9bcd197059effecaf1ae6d3353ba76ccb640b176993c9afba", "EXPERIMENTS/EXP-LEO-V2-ACCEPT-R4/analysis-request.json": "d4f4c6c15bdc4fd883d75b6aa1151771aa107a86a43c9f6059dd49f7d3692b15", "EXPERIMENTS/EXP-LEO-V2-ACCEPT-R4/compile-report.json": "51512604648f7b9dfa4e388d1d8e9e53cf0742cf5f6b6bff4db0caecc1c91425", "EXPERIMENTS/EXP-LEO-V2-ACCEPT-R4/request.json": "d3e509aa0b0feb3a009d295a153f7f46318242985e1cac387f49bb916c18ac5e", "EXPERIMENTS/EXP-LEO-V2-ACCEPT-R4/resolved/EXP-LEO-V2-ACCEPT-R4-control-s7.leo-sim.yaml": "e8ba74c8c0fabfb70be58c786ed74d2fcd20bcf23ab13d9c474fdb7ab13cba00", "EXPERIMENTS/EXP-LEO-V2-ACCEPT-R4/resolved/EXP-LEO-V2-ACCEPT-R4-treatment-s7.leo-sim.yaml": "8e470a03594ad4a8eeb827ccdebc6b4bd9a7ab25198c882281a9e9300431d656", "EXPERIMENTS/EXP-LEO-V2-ACCEPT-R4/run-manifest.json": "af7c7e18a082d951d38d1c68cd75fa4fbd8658dea694a073ccc638e872f7db93"}, "blocking_findings": [], "evidence": ["platform-chain acceptance fixture, not a scientific review; the ARTIFACT review is a separate step"], "independence": {"producer_and_reviewer_are_distinct": true, "review_started_from_declared_inputs": true}, "producer_id": "producer:platform-acceptance", "producer_session_id": "P-accept-r1", "receipt_id": "RR-ACCEPT-ADVERSARIAL", "required_revision": [], "reviewer_id": "reviewer:adversarial", "reviewer_session_id": "R-adversarial", "revision": 1, "role": "adversarial", "schema": "agent-review-receipt/v2", "unknowns": [], "verdict": "PASS", "work_id": "WP-LEO-V2-ACCEPT-R4"}
