{"artifact_hashes": {"EXPERIMENTS/EXP-LEO-V2-PRE-TRUST-REPRO/RUNBOOK.md": "963b0d48c9cab752dd02347b044e013222ba5c2caaa91da8f52ebc2d51467e4d", "EXPERIMENTS/EXP-LEO-V2-PRE-TRUST-REPRO/analysis-request.json": "9e510710405b19e7efb8cdbc75663620feebe83b2f854af82df628a5ac61f18b", "EXPERIMENTS/EXP-LEO-V2-PRE-TRUST-REPRO/compile-report.json": "1cb490a2924424710a036896f4612f9d17e1b624aee4d19980d46d211c14d799", "EXPERIMENTS/EXP-LEO-V2-PRE-TRUST-REPRO/request.json": "1616a8d864c420e910f15933b1a42da4ecbf06497ceeef7ac4a961d188ecee7f", "EXPERIMENTS/EXP-LEO-V2-PRE-TRUST-REPRO/resolved/EXP-LEO-V2-PRE-TRUST-REPRO-control-s7.leo-sim.yaml": "e8ba74c8c0fabfb70be58c786ed74d2fcd20bcf23ab13d9c474fdb7ab13cba00", "EXPERIMENTS/EXP-LEO-V2-PRE-TRUST-REPRO/resolved/EXP-LEO-V2-PRE-TRUST-REPRO-treatment-s7.leo-sim.yaml": "8e470a03594ad4a8eeb827ccdebc6b4bd9a7ab25198c882281a9e9300431d656", "EXPERIMENTS/EXP-LEO-V2-PRE-TRUST-REPRO/run-manifest.json": "cce6a75dec7f48b8f865bef2bab362caeaaa58990286c986d9a7058bdd842775"}, "blocking_findings": [], "evidence": ["fixture: gate reproduction, not a scientific review"], "independence": {"producer_and_reviewer_are_distinct": true, "review_started_from_declared_inputs": true}, "producer_id": "producer:pre-experiment-trust", "producer_session_id": "P-pre-trust-r1", "receipt_id": "RR-PRE-TRUST-SATELLITE_DRL", "required_revision": [], "reviewer_id": "reviewer:satellite_drl", "reviewer_session_id": "R-satellite_drl", "revision": 1, "role": "satellite_drl", "schema": "agent-review-receipt/v2", "unknowns": [], "verdict": "PASS", "work_id": "WP-LEO-V2-PRE-TRUST-REPRO"}
