{
  "schema": "agent-review-receipt/v2",
  "receipt_id": "RR-E0-LOAD-FORMAL-R03-SAT",
  "work_id": "WP-LEO-V2-E0-LOAD-FORMAL",
  "revision": 3,
  "producer_id": "producer:codex",
  "producer_session_id": "P-leo-v2-e0-load-formal-r03",
  "reviewer_id": "reviewer:e0-load-satellite-drl-r03",
  "reviewer_session_id": "R-e0-load-satellite-drl-r03",
  "independence": {"producer_and_reviewer_are_distinct": true, "review_started_from_declared_inputs": true},
  "role": "satellite_drl",
  "verdict": "PASS",
  "evidence": [
    "Independent review verified all cells use 140 satellites, seven planes, 20 s, MCS, 0.1 s time step and one-second Markovian rematching.",
    "The 50/100/200 Mbps rates and 8-16 s two-times burst imply 70/140/280 Mbps integrated averages; no fixed-rate or static-neighbor substitution is introduced.",
    "The repository M-Lab snapshot is explicitly measurement_proxy traffic with reproducible endpoint selection, not calibrated operator traffic; the R03 boundary excludes DRL or paper claims.",
    "The one-line JSON syntax repair after prior review changes no runtime configuration or compiled artifact."
  ],
  "artifact_hashes": {
    "CODE/work/WP-LEO-V2-E0-LOAD-FORMAL/R03/brief.json": "3c6dd7317f6ad02fa2007344649d821f8f47d9296b743cc0e3d18eda52f9d9b8",
    "CODE/work/WP-LEO-V2-E0-LOAD-FORMAL/R02/request-source.json": "91b97f057085941616a3f05a25df577960c47807a0aeb54a15cfd872fbb638d8",
    "EXPERIMENTS/EXP-20260822-E0-LOAD-FORMAL-R02/RUNBOOK.md": "6b304a034b84161ed96d1a98ba437e2710498d0f612068a2e9240d96c72a948c",
    "EXPERIMENTS/EXP-20260822-E0-LOAD-FORMAL-R02/analysis-request.json": "d40fa9be4c8b8a43fce1cb9e69339569ec2ddfda7ea45ac12934f88923b51f82",
    "EXPERIMENTS/EXP-20260822-E0-LOAD-FORMAL-R02/compile-report.json": "b9aba9969c22e9a11786576b478c47942698c4ad45280ce2185628c55087ec9f",
    "EXPERIMENTS/EXP-20260822-E0-LOAD-FORMAL-R02/request.json": "98a77bdadd2300a3b261367246009d0426b3e5998e0341d901040acb412d8d49",
    "EXPERIMENTS/EXP-20260822-E0-LOAD-FORMAL-R02/resolved/EXP-20260822-E0-LOAD-FORMAL-R02-high_control-s7.leo-sim.yaml": "3cc854e1782d14e7be1c7ce5ec068d1bedb0d8a46afbfd3557f1e012ed44b994",
    "EXPERIMENTS/EXP-20260822-E0-LOAD-FORMAL-R02/resolved/EXP-20260822-E0-LOAD-FORMAL-R02-high_copy-s7.leo-sim.yaml": "3cc854e1782d14e7be1c7ce5ec068d1bedb0d8a46afbfd3557f1e012ed44b994",
    "EXPERIMENTS/EXP-20260822-E0-LOAD-FORMAL-R02/resolved/EXP-20260822-E0-LOAD-FORMAL-R02-low_control-s7.leo-sim.yaml": "d9c2acfaa36c621439c1711d9565e29ca2feda6b67cfc02a7f7f90ad5b770ea7",
    "EXPERIMENTS/EXP-20260822-E0-LOAD-FORMAL-R02/resolved/EXP-20260822-E0-LOAD-FORMAL-R02-low_copy-s7.leo-sim.yaml": "d9c2acfaa36c621439c1711d9565e29ca2feda6b67cfc02a7f7f90ad5b770ea7",
    "EXPERIMENTS/EXP-20260822-E0-LOAD-FORMAL-R02/resolved/EXP-20260822-E0-LOAD-FORMAL-R02-medium_control-s7.leo-sim.yaml": "8284cc176c61f7fd7d096215f98613fa0a33a72903daa210cf124cacfd551be3",
    "EXPERIMENTS/EXP-20260822-E0-LOAD-FORMAL-R02/resolved/EXP-20260822-E0-LOAD-FORMAL-R02-medium_copy-s7.leo-sim.yaml": "8284cc176c61f7fd7d096215f98613fa0a33a72903daa210cf124cacfd551be3",
    "EXPERIMENTS/EXP-20260822-E0-LOAD-FORMAL-R02/RUNBOOK.md": "6b304a034b84161ed96d1a98ba437e2710498d0f612068a2e9240d96c72a948c",
    "EXPERIMENTS/EXP-20260822-E0-LOAD-FORMAL-R02/run-manifest.json": "1154cecf814a9afb779b2c0891e009d82916a19dfb9cd90e04189f633368c3ca"
  },
  "blocking_findings": [],
  "unknowns": ["This scan does not freeze a final load or establish seed robustness."],
  "required_revision": []
}
