{
  "schema": "agent-review-receipt/v2",
  "receipt_id": "RR-E0-FORMAL-R01-ADV",
  "work_id": "WP-LEO-V2-E0-FORMAL",
  "revision": 1,
  "artifact_hashes": {
    "CODE/work/WP-LEO-V2-E0-FORMAL/R01/brief.json": "87c3e2a8de7030c5b22d2e50aae68a0dcdd0fb41e4e945263178b80a40791830",
    "EXPERIMENTS/EXP-20260821-E0-FORMAL-R01/RUNBOOK.md": "b364d0d1921042c75aa16fdbb8abfe118e3f28e44d4a73911ef0bc7b23813335",
    "EXPERIMENTS/EXP-20260821-E0-FORMAL-R01/analysis-request.json": "60ebb601346e80a4090e740979a6923e071cdfb829fc86bd747d0613357a4175",
    "EXPERIMENTS/EXP-20260821-E0-FORMAL-R01/compile-report.json": "6961a923f49503ba2edeb2f58aa7957a518025c686a84a55668b103319b9fd11",
    "EXPERIMENTS/EXP-20260821-E0-FORMAL-R01/request.json": "6e1979c17064b6b85d70eac9b70222f02a69b83faf9ab5ec3c0c1684e67fa447",
    "EXPERIMENTS/EXP-20260821-E0-FORMAL-R01/resolved/EXP-20260821-E0-FORMAL-R01-main-s7.leo-sim.yaml": "393e3a95e167b22413115341dfb99a2f39d9451133c60f5a43de8e8c4f4980c5",
    "EXPERIMENTS/EXP-20260821-E0-FORMAL-R01/run-manifest.json": "a4327abdeff3d9003671d332ffff48b5d2678ab319e0a68f5f6f8a2de37293a2"
  },
  "producer_id": "producer:codex",
  "producer_session_id": "P-leo-v2-e0-formal-r01",
  "reviewer_id": "reviewer:adversarial-e0-formal-r01",
  "reviewer_session_id": "R-adversarial-e0-formal-r01",
  "independence": {
    "producer_and_reviewer_are_distinct": true,
    "review_started_from_declared_inputs": true
  },
  "role": "adversarial",
  "verdict": "PASS",
  "evidence": [
    "对 compile-report request SHA、manifest execution_authorized、analysis manifest SHA、acceptance、trace identity、code SHA、run ID、artifact hash map、配置路径目录穿越、绝对路径和符号链接进行篡改测试，授权器均 fail-closed。",
    "当前 V2 artifact verification PASS；没有生成 authorization、receipt 或 governance receipt，故运行前置状态仍清晰。",
    "非阻塞限制已记录：require_data_isl 的运行时判定依赖受信路径长度，receipt validator 尚未把路径逐跳与 link_service_windows 独立交叉核对；本次只作为工程到正式桥接运行，不能把它外推为论文级独立物理证明。"
  ],
  "blocking_findings": [],
  "unknowns": [
    "正式 VM 运行、自然结束、守恒、acceptance 和结果重算尚未发生。"
  ],
  "required_revision": []
}
