{
  "schema": "agent-review-receipt/v2",
  "work_id": "WP-LEO-V2-GLOBAL-PRESSURE-BRACKET",
  "revision": 1,
  "producer_id": "producer:codex-global-pressure",
  "producer_session_id": "P-global-pressure-r01",
  "independence": {
    "producer_and_reviewer_are_distinct": true,
    "review_started_from_declared_inputs": true
  },
  "verdict": "PASS",
  "artifact_hashes": {
    "CODE/work/WP-LEO-V2-GLOBAL-PRESSURE-BRACKET/R01/coverage-audit.json": "b5631b2d4e40bc96b77e69459ae50b44b467d08b22373fcd4e63e7ebbe8912ae",
    "CODE/work/WP-LEO-V2-GLOBAL-PRESSURE-BRACKET/R01/scene-check-contract.json": "574880a791f9f3276642caebed8f4329e3cd77f59d5fc528ef629fa774102ec5",
    "CODE/work/WP-LEO-V2-GLOBAL-PRESSURE-BRACKET/R01/scene-decision.yaml": "9ad82a9ac4c4f86c13e38881236f8a438c2750140b7a6a8d49f7929e98b17d9b",
    "EXPERIMENTS/EXP-20260826-GLOBAL-PRESSURE-BRACKET-R01/RUNBOOK.md": "06ec33060a383f8be9ebd9d73db17d441036db0863003a064c9d347fe19d437c",
    "EXPERIMENTS/EXP-20260826-GLOBAL-PRESSURE-BRACKET-R01/analysis-request.json": "7a0ec0d9aa5560b66481f408a7c931e5e7a4e8435b7f6e539f6fbc701f3b0f1c",
    "EXPERIMENTS/EXP-20260826-GLOBAL-PRESSURE-BRACKET-R01/compile-report.json": "38653f2d74d99e6778da7f3fc2e18790c99a0bc58c626c092ce9385667ff486c",
    "EXPERIMENTS/EXP-20260826-GLOBAL-PRESSURE-BRACKET-R01/request.json": "1db1953de69d9e8f94eadbdb79760cf76801ddb97f51aa94c986fcc4a72fee53",
    "EXPERIMENTS/EXP-20260826-GLOBAL-PRESSURE-BRACKET-R01/resolved/EXP-20260826-GLOBAL-PRESSURE-BRACKET-R01-load10_a-s7.leo-sim.yaml": "bae0c72dfe8b86f687993027fbdfaf1f3e8d1d353f6eb11a9068c5bc19d3a7b4",
    "EXPERIMENTS/EXP-20260826-GLOBAL-PRESSURE-BRACKET-R01/resolved/EXP-20260826-GLOBAL-PRESSURE-BRACKET-R01-load10_b-s7.leo-sim.yaml": "bae0c72dfe8b86f687993027fbdfaf1f3e8d1d353f6eb11a9068c5bc19d3a7b4",
    "EXPERIMENTS/EXP-20260826-GLOBAL-PRESSURE-BRACKET-R01/run-manifest.json": "a33c8b63cb17d88b787a1437b27f5a4051711aca7601fcd88fab74e14c67c545"
  },
  "blocking_findings": [],
  "required_revision": [],
  "receipt_id": "RR-GLOBAL-PRESSURE-R01-ADV",
  "reviewer_id": "reviewer:kimi-acp-3d835edc389ab89d511d301d651e20d0",
  "reviewer_session_id": "R-kimi-acp-3d835edc389ab89d511d301d651e20d0",
  "role": "adversarial",
  "evidence": [
    "Exact-SHA adversarial review found no blocking bypass and no path that relabels access, route, or downlink failure as ISL pressure; classifier order and the consecutive same-link ISL gate were checked at CODE/leo_sim/scene_check.py:873-891 and :633-699.",
    "The scene contract, coverage audit, and matrix artifact chain were cross-referenced and local byte hashes, 16,988 endpoint count, unique names, and zero never-visible rows were independently verified.",
    "The review identified only minor/info items: CLI trace self-comparison, unused observation fields, missing-at queue timing default, utilization truncation, insertion-order candidate selection, and incomplete matrix runbook authorization wording.",
    "The review used kimi_acp only, not Pro, and left finalization, authorization, deployment, and VM execution explicitly open."
  ],
  "unknowns": [
    "Receipt/trace implementation details outside the declared review paths were not re-read by Kimi; local authorization remains fail-closed.",
    "The CLI self-comparison is a follow-up and must not be described as an independent trace cross-check."
  ]
}
